{
  "title": "AWS User Group Mysuru \u2013 Inaugural Meetup",
  "date": "2026-03-27",
  "startTime": "10:00",
  "format": "in-person",
  "venue": {
    "name": "VVCE",
    "city": "Mysuru"
  },
  "speakers": [],
  "description": "The launch of AWS User Group Mysuru, bringing together industry professionals, community builders and learners to discuss cloud technologies \u2014 including AWS, DevOps and AI. Free and open to professionals, students and technology enthusiasts alike.",
  "registrationUrl": "https://www.meetup.com/awsugmys/events/313709004/",
  "blogPost": "2026-03-27-aws-user-group-mysuru-inaugural-meetup",
  "endTime": "13:00"
}
