{
  "title": "Strands Agents Hands-On: Build Your First Agent on AWS",
  "date": "2026-10-31",
  "startTime": "17:00",
  "endTime": "19:00",
  "format": "online",
  "description": "Join AWS User Group Mysuru for a hands-on technical session on building autonomous AI agents on AWS. In this session, you will explore the core concepts of AI agents and get step-by-step experience constructing your first functional agent on cloud infrastructure.",
  "registrationUrl": "https://www.meetup.com/awsugmys/events/317117374/",
  "meetupId": "event_317117374@meetup.com",
  "_meetupSync": {
    "title": "Strands Agents Hands-On: Build Your First Agent on AWS",
    "date": "2026-10-31",
    "startTime": "17:00",
    "endTime": "19:00",
    "format": "online",
    "description": "Join AWS User Group Mysuru for a hands-on technical session on building autonomous AI agents on AWS. In this session, you will explore the core concepts of AI agents and get step-by-step experience constructing your first functional agent on cloud infrastructure.",
    "registrationUrl": "https://www.meetup.com/awsugmys/events/317117374/"
  }
}
