{
  "title": "AWS re:Invent Watch & Build Party by AWS User Group Mysuru",
  "date": "2026-12-04",
  "startTime": "16:30",
  "endTime": "21:00",
  "format": "in-person",
  "venue": { "name": "Venue to be announced", "city": "Mysuru" },
  "speakers": [],
  "description": "For the very first time, AWS User Group Mysuru brings the excitement of AWS re:Invent to Mysuru. Watch the keynotes and top announcements together, build in hands-on workshops and collaborative mini-hack sessions, and connect through mentorship, career guidance and networking with developers, architects and cloud leaders.",
  "note": "Free, with registration review and limited seats (200). Venue details coming soon.",
  "registrationUrl": "https://builder.aws.com/connect/event/678555da-1041-337f-979d-7039168c905d",
  "alternateUrl": "https://builder.aws.com/connect/event/88105936-4a6b-3346-9172-2f8ae36b22e2"
}
