{
  "title": "Roadmap to AWS Certifications: From Associate to Golden Jacket",
  "date": "2026-05-23",
  "startTime": "18:00",
  "endTime": "19:30",
  "format": "online",
  "speakers": [
    {
      "name": "Vishnu Rachapudi",
      "title": "Cloud & AI Engineer, AWS Golden Jacket holder (14x AWS certified)"
    }
  ],
  "description": "A practical roadmap for AWS certifications from Associate to Professional and Specialty: planning your path around your career goals, effective study habits and resources, balancing hands-on building with theory, and a live Q&A.",
  "registrationUrl": "https://www.meetup.com/awsugmys/events/314814215/",
  "recordingUrl": "https://www.youtube.com/live/JWqe86Kj0T0?si=CfwJGWwMDMKJQzft"
}
