{
  "title": "Beyond the Prompt: Spec-Driven Development with Kiro and the AI-Driven Development Lifecycle",
  "date": "2026-04-18",
  "startTime": "17:00",
  "endTime": "18:00",
  "format": "online",
  "speakers": [],
  "description": "Why the shift from vibe coding to spec-driven development matters for teams building at scale — unpacked through Kiro, AWS's agentic IDE, and the AI-Driven Development Lifecycle (AIDLC).",
  "registrationUrl": "https://www.meetup.com/awsugmys/events/314160083/",
  "recordingUrl": "https://www.youtube.com/live/mK3tlh81XpU?si=b70vOcfNCGpn-KAY",
  "blogPost": "2026-04-18-beyond-the-prompt-spec-driven-development-with-kiro"
}
